{
  "schemaVersion": 1,
  "sessionSetName": "069-automated-pull-critique-capabilities",
  "notes": "Example: one admitted candidate (all gates pass + human approved) and one waived candidate (an explicit decision not to promote).",
  "candidates": [
    {
      "id": "CF1",
      "defect": {
        "findingRef": "openai:0",
        "description": "validate_contract_floor_result crashes on a malformed-bytes activity log instead of returning not-ok",
        "severity": "Major"
      },
      "falsifier": {
        "templateId": "validator-on-malformed-bytes",
        "args": { "module": "ai_router.contract_gate", "function": "validate_contract_floor_result" }
      },
      "entrypoint": {
        "kind": "public_api",
        "ref": "ai_router.contract_gate.validate_contract_floor_result"
      },
      "contractKind": "public_contract",
      "failsOnOld": { "ref": "v0.22.0", "failed": true, "outputHash": "sha256:deadbeef" },
      "passesOnFixed": { "ref": "v0.22.1", "passed": true },
      "flakeCheck": { "runs": 5, "agreeing": 5, "stable": true },
      "owner": "denmi",
      "humanSignoff": { "status": "approved", "by": "denmi", "at": "2026-06-16T12:00:00-04:00" }
    },
    {
      "id": "CF2",
      "defect": {
        "findingRef": "google:1",
        "description": "A wall-clock timing assertion that reproduced once but is incidental, not a public contract"
      },
      "falsifier": { "commandId": "timing-probe" },
      "entrypoint": { "kind": "cli", "ref": "python -m ai_router.metrics" },
      "contractKind": "incidental",
      "failsOnOld": { "ref": "v0.22.0", "failed": true },
      "passesOnFixed": { "ref": "v0.22.1", "passed": true },
      "flakeCheck": { "runs": 5, "agreeing": 3, "stable": false },
      "owner": "denmi",
      "humanSignoff": { "status": "waived", "by": "denmi", "note": "incidental timing + flaky; not floor-worthy" }
    }
  ]
}
